obj_regio1,obj_heatingType,obj_telekomInternetUrlAddition,obj_cId,obj_newlyConst,obj_balcony,obj_picture,obj_picturecount,obj_usableArea,obj_yearConstructed,ga_cd_developer_virtualreality,geo_ot,obj_privateOffer,obj_scoutId,obj_noParkSpaces,obj_firingTypes,obj_hasKitchen,obj_ExclusiveExpose,obj_courtage,geo_bln,obj_cellar,obj_purchasePriceRange,obj_yearConstructedRange,obj_rentSubsidy,obj_telekomInternetUrlBase,obj_houseNumber,obj_energyType,obj_livingSpace,geo_krs,obj_zipCode,obj_condition,obj_interiorQual,obj_highDemand,obj_energyEfficiencyClass,ga_cd_cxp_historicallisting,obj_parkingSpace,obj_street,obj_lift,obj_commissionsettings,obj_streetPlain,obj_typeOfFlat,geo_plz,obj_noRooms,obj_thermalChar,obj_assistedLiving,obj_ityp,obj_telekomInternetAvailable,geo_land,ga_cd_via,obj_immotype,obj_rented,obj_privateOfferInvestmentCheck,obj_contactFormInputFieldCount,obj_floor,obj_telekomInternetSpeed,obj_cwId,obj_purchasePrice,ga_cd_application_requirements,obj_numberOfFloors,geo_bg,obj_noRoomsRange,ga_cd_maillead_default_shown,obj_garden,obj_regio4,obj_barrierFree,obj_international,obj_regio3,obj_objectnumber,obj_livingSpaceRange,obj_regio2,url,extract_date,extract_time,online_since,title,description,equipments,locations,obj_galleryAd,ga_cd_via_qualified,evt_count_pm_sig,obj_groupnumber,obj_lastRefurbish
Baden_Württemberg,central_heating,eyJvcnQiOiJTdHV0dGdhcnQiLCJvcnRzdGVpbCI6IiIsInN0cmFzc2UiOiJNYWNodG9sZndlZyIsImhhdXNudW1tZXIiOiI1NiIsImtsc2lkIjoxNzA4NjM3NCwiaGF1c251bW1lcnp1c2F0eiI6IiIsInBseiI6IjcwNTY3In0%3D,19984570,n,y,https://pictures.immobilienscout24.de/listings/3c24dc02-663e-4bb7-b66e-c863de12ae9a-1925187750.jpg/ORIG/resize/118x118%3E/extent/118x118/format/webp/quality/73,14,1,1971,true,möhringen_ost,false,160697624,1,oil,n,false,y,baden_württemberg,y,6,3,315,https://www.telekom.de/festnetz/tarife-und-optionen/internet-dsl,no_information,energy_consumption,71.43,stuttgart,70567,well_kept,no_information,,E,false,garage,no_information,n,flow:0,no_information,apartment,,2,143,n,"2,active",true,deutschland,top,wohnung_kauf,n,false,7,1,175 MBit/s,002.01014048656,269000,profile0,3,möhringen,2,true,n,Möhringen_Ost,n,n,Möhringen,SI-042025_9,3,Stuttgart,https://www.immobilienscout24.de/expose/160697624,2025-07-28,01:23:15,2025-07-26T12:38:06.000+02:00,"Natur Pur!
Idyllische 2 Zimmerwohnung mit Balkon sowie Gartennutzung, Nähe der Körsch","Herzlich Willkommen in unserem Angebot einer idyllischen
2 Zimmerwohnung mit Südbalkon, Garage und Stellplatz davor in Möhringen, nahe der Natur mit Gartennutzung, unmittelbar am Wald,
die Ihnen naturnahe Erholung ermöglicht.

Diese gepflegte 2 Zimmerwohnung mit ca. 71,43 m² befindet sich im 1. OG eines Mehrfamilienhauses mit 8 Parteien und 3 Etagen, welches 1971 erbaut wurde.

Diese effizient geschnittene Wohnung mit 2 großen Zimmern verschwendet keine wertvolle Wohnfläche, sondern überzeugt mit einem praktischen Grundriss. Der zentrale Flur bietet nicht nur ausreichend Platz für eine Garderobe und einen Abstellraum innerhalb der Wohnung, sondern führt Sie auch zu allen Räumen.
Vom lichtdurchfluteten großzügigen Wohn- und Esszimmer mit großen Fensterfronten gelangen Sie direkt auf den Südbalkon mit herrlichem Ausblick ins Grüne.
Auch das Schlafzimmer ist ausgesprochen geräumig und bietet ausreichend Platz.
Die Küche verfügt über eine Einbauküche, ausgestattet mit allen Elektogroßgeräten.
Das Tageslichtbad ist ausgestattet mit Badewanne, Wachbecken und WC.
Alle Wohnräume sind mit einem hochwertigen Parkett ausgestattet, Küche, Bad und WC sind gefliest. 

Im UG stehen Ihnen 2 Kellerräume sowie eine Waschküche und ein Trockenraum zur Verfügung.

Ihr Auto parken Sie bequem in der Garage mit Überlänge oder auf dem Stellplatz davor.

Das Hausgeld beträgt 296,00 €

Den virtuellen Rundgang erreichen Sie über folgenden Link:
https://my.matterport.com/show/?m=DAxTyS5qV8o

Gerne präsentieren wir Ihnen diese schöne Immobilie bei einer privaten Besichtigung. Wir freuen uns auf Ihre Kontaktaufnahme.","- Tageslichtbad mit Badewanne, Waschbecken und WC
-  Abstellraum innerhalb der Wohnung + 2 Kellerräume

Einbauküche:
- Großes freistehendes Liebherr Kühl-/Gefrier-Standgerät mit BioFresh-Null-Grad-Fach und NO-Frost-Gefrier-Funktion, A+++
- Siemens Glaskeramik-Kochfeld mit mehreren zuschaltbaren Kochfeldgrößen
- Siemens Herd mit versenkbaren Drehknöpfen, Klartextanzeige, mit vielen Funktionen wie 3D-Heißluft, Grill, Bratautomatik, Memofunktion, usw. sowie Pyrolyse Selbstreinigung
- Bosch Geschirrspüler

2 Kellerräume

Sondernutzungsrechte im Garten

Garage mit Überlänge und Fenster + Stellplatz davor","Naturverbunden wohnen und zugleich hervorragend angebunden –
diese Wohnung bietet beides!
Die idyllische Lage in Stuttgart-Möhringen, unmittelbar am Wald,
ermöglicht Ihnen naturnahe Erholung
direkt vor der Haustür und bietet einen wunderschönen Ausblick ins
Grüne. Gleichzeitig überzeugt die
Wohnung durch eine gute Anbindung und Nähe zu zentralen
Anlaufpunkten der Region: Das SI-Zentrum
mit seinen vielfältigen Freizeitangeboten, die Universität
Hohenheim, EnBW City, das Daimler-Werk und
das Pressehaus Stuttgart sind in wenigen Minuten erreichbar und
machen diesen Standort besonders attraktiv.
Für Pendler und Reisende ist die Lage ideal: Die Anbindung an die
B 27 sowie der kurze Weg zum Stuttgarter
Flughafen ermöglichen eine bequeme Erreichbarkeit des regionalen
und überregionalen Verkehrsnetzes.
Auch der öffentliche Nahverkehr ist bestens erschlossen – die Busund
U-Bahnhaltestelle ""Landhaus"" (Linie U3)
ist fußläufig erreichbar und nur eine Station vom SI-Zentrum und
der Universität Hohenheim in Plieningen entfernt.
Diese Kombination aus Natur und Stadtnähe macht die Wohnung
zu einem perfekten Ausgangspunkt für urbanes
Wohnen im Grünen.",,,,,
Baden_Württemberg,central_heating,,5394580,n,y,https://pictures.immobilienscout24.de/listings/2aa716dd-4c0b-47e4-9bb6-ca7bd7faa5e8-1925258357.jpg/ORIG/resize/118x118%3E/extent/118x118/format/webp/quality/73,17,,1992,,münster,false,160701963,1,district_heating,y,true,n,baden_württemberg,y,7,5,366,,no_information,energy_consumption,88.31,stuttgart,70376,well_kept,no_information,,C,false,underground_garage,no_information,n,flow:0,no_information,ground_floor,,3,81,n,"2,active",false,deutschland,top,wohnung_kauf,n,false,11,0,,001.5394580,399000,profile0,5,münster,3,true,y,Münster,n,n,Münster,360270,4,Stuttgart,https://www.immobilienscout24.de/expose/160701963,2025-07-28,01:23:18,2025-07-26T19:55:37.000+02:00,"Moderne 3 Zimmer-Erdgeschosswohnung mit Terrasse, Klimaanlage und TG Stellplatz","Die Wohnanlage wurde 1992 auf einem 3.197 qm großen Grundstück erbaut. Die Häuser sind mit schönen, parkähnlichen Grünfläche umgeben.

Die Häuser wurden stetig in Stand gehalten.
Die Fassade sowie das Dach sind gedämmt. Die komplette Anlage wird durch Fernwärme beheizt. Das Treppenhaus ist sehr gepflegt und die Außenanlage wird von einem Hausmeisterservice betreut.
Ein herrlicher Garten für gemütliche Stunden im Freien lädt zum Verweilen ein. 
Die Nebenkosten der Wohnung inkl. Rücklagen betragen € 365,87. 

Das Haus befindet sich im Sanierungsgebiet der Stadt Stuttgart. Somit wird in öffentliche Plätze der Umgebung investiert und die Grundstücke aufgewertet.","Terrasse, Garten, Keller, Einbauküche, Parkett, Laminat, Teppichboden, Fliesen

Bemerkungen:
Die 3 Zimmer Wohnung besteht aus Küche, Wohnzimmer und Kinder / Arbeitszimmer, sowie einem Badezimmer mit Dusche, einem separatem WC, Abstellraum, einer Terrasse mit Garten, einem Kellerraum und einem Doppelparker Tiefgaragenstellplatz.

Die Wohnung wurde in den letzten Jahren umfangreich modernisiert.
2020 wurde eine Glastüre in den Duschbereich eingebaut, und der Tiefgaragenstellplatz erneuert.
2022 wurde eine neue Heizanlage im Haus, sowie ein neuer Sichtschutz mit Türe für einen direkten Zugang über die Terrasse eingebaut.
2023 wurden alle Fenster und Rollläden der Wohnung ersetzt. Es wurden spezielle Schallschutzfenster verbaut. Die Rollläden im Essbereich und Schlafzimmer, sowie Terrassentüren sind elektrisch. In Schlafzimmer, Küche, Kinderzimmer / Arbeitszimmer und Terrassentüre ist ein im Rolladen integrierter Insektenschutz verbaut.
2024 wurde in Wohnzimmer und Schlafzimmer eine Klimaanlage verbaut.

Sämtliche Lichtschalter (außer WC) sowie die elektrischen Rollläden sind Smarthome fähig, und Apple AirPlay fähig.","Eine idyllische, ruhige Lage in Stuttgart Münster. Das Haus steht mitten im Grünen abseits der Straße am Ende einer Sackgasse.
Zwei U-Bahn Haltestellen der Linien U12 und U14, sowie eine Bushaltestelle der Linie 56 erreicht man zu Fuß in wenigen Minuten. Ein Lebensmittelladen, sowie Restaurants befinden sich in unmittelbarer Nähe.
Der nahe liegende Neckar, der Max Eyth See und die Weinberge bieten vielfältige Freizeitmöglichkeiten.
Infrastruktur (im Umkreis von 5 km):
Apotheke, Lebensmittel-Discount, Allgemeinmediziner, Kindergarten, Grundschule, Gesamtschule, Öffentliche Verkehrsmittel",disabled,,,,
Baden_Württemberg,central_heating,eyJvcnQiOiJTdHV0dGdhcnQiLCJvcnRzdGVpbCI6IiIsInN0cmFzc2UiOiJFbmdlbGJlcmdzdHIuIiwiaGF1c251bW1lciI6IjI4Iiwia2xzaWQiOjIxNjc4MTMyLCJoYXVzbnVtbWVyenVzYXR6IjoiIiwicGx6IjoiNzA0OTkifQ%3D%3D,16969608,n,n,https://pictures.immobilienscout24.de/listings/5fe30a1d-ec47-4243-b8bd-5f1332559a25-1925203297.jpg/ORIG/resize/118x118%3E/extent/118x118/format/webp/quality/73,11,9,1971,,giebel,false,160698369,,gas,y,false,y,baden_württemberg,n,4,3,794,https://www.telekom.de/festnetz/tarife-und-optionen/internet-dsl,28,energy_consumption,136,stuttgart,70499,need_of_renovation,simple,,D,false,no_information,Engelbergstr.,n,flow:1,Engelbergstr.,ground_floor,,4,102,n,"2,active",true,deutschland,premium,wohnung_kauf,n,false,11,0,16 MBit/s,002.01007758986,190000,profile0,10,weilimdorf_bezirk,4,true,n,Giebel,y,n,Weilimdorf_Bezirk,160698369,6,Stuttgart,https://www.immobilienscout24.de/expose/160698369,2025-07-28,01:23:21,2025-07-26T14:06:32.000+02:00,3-4 Zimmer-Wohnung,"Die Wohnung befindet sich in einer gepflegten Wohnanlage im beliebten
Stadtteil Weilimdorf-Giebel. Die Anlage umfasst 12 Häuser mit insgesamt
330 Wohnungen sowie 364 Stellplätzen – davon 188 in der Tiefgarage
und 176 im Außenbereich. Das gesamte Areal wurde auf einem rund
29.841 m² großen Grundstück errichtet.

Ursprünglich sollte die Einheit als Kinderhort genutzt werden.
Der Antrag auf Nutzungsänderung von einem Kinderhort zu
Wohnzwecken vom 24.03.2025 wurde am 15.05.2025 genehmigt. Da die
Einheit bereits als Wohnung genutzt wurde, sind lediglich kleinere
bauliche Maßnahmen erforderlich.
Es müssen noch 2 bestehenden WC´s (in den Abstellräumen) entfernt werden.
Dann kann die Wohnung kann nach dem
Austausch zweier Fenster und einem erstellten Schallschutzgutachten
umgehend bezogen werden.","Diese charmante 4-Zimmer-Wohnung überzeugt durch ihre großzügige
Raumaufteilung.
Auf rund 135,52 m² Wohnfläche erwartet Sie ein großes Wohnzimmer, das
viel Raum für entspannte Stunden bietet. Angrenzend lädt ein separates Esszimmer
mit integrierter Küche zu gemeinsamen Kochabenden und geselligen Mahlzeiten ein.
Zwei gut geschnittene Schlafzimmer bieten vielseitige Nutzungsmöglichkeiten – ob
als Eltern-, Kinder- oder Arbeitszimmer, hier findet jeder seinen Platz. Der große,
einladende Flur schafft nicht nur eine freundliche Atmosphäre beim Eintreten,
sondern bietet auch ausreichend Platz für Garderobe und zusätzliche Möbel.
Drei praktische Abstellräume innerhalb der Wohnung sorgen für maximalen Stauraum
und unterstützen ein aufgeräumtes Wohngefühl. Abgerundet wird das Raumangebot
durch ein Tageslichbad, das für zusätzlichen Komfort im Alltag sorgt.
Diese Wohnung eignet sich ideal für Paare, kleine Familien oder alle, die ein
großzügiges Wohnkonzept mit viel Platz und praktischen Lösungen zu schätzen
wissen.
Auch als WG ist diese Einheit ideal nutzbar.

PARKIERUNG:
Vor dem Haus stehen komfortable Außenstellplätze für Kurzbesucher und
Hausbewohner bereit.
Die Wohneinheit selbst hat keinen eigenen Stellplatz","Weilimdorf ist ein Stadtteil im Nordwesten von Stuttgart und
zeichnet sich durch seine Mischung aus urbanem und ländlichem
Flair aus. Der Teilbereich Giebel befindet sich im Norden von
Weilimdorf und bietet eine ruhige und gleichzeitig gut erschlossene
Wohnlage. Der Stadtteil hat sowohl eine dörfliche Struktur als auch
eine gute Anbindung an das städtische Leben.

Verkehrsanbindung:
Weilimdorf-Giebel ist hervorragend an das Verkehrsnetz
angebunden. Die S-Bahn-Linien S4 und S5 verkehren regelmäßig und
bieten eine schnelle Verbindung in die Stuttgarter Innenstadt sowie
in die Umgebung. Zudem ist der Autobahnanschluss A81 in wenigen
Minuten erreichbar, was die Anreise mit dem Auto sehr komfortabel
macht.
Einkaufsmöglichkeiten",,true,,,
Baden_Württemberg,central_heating,eyJvcnQiOiJFc3NsaW5nZW4gYW0gTmVja2FyIiwib3J0c3RlaWwiOiIiLCJzdHJhc3NlIjoiUm9zZW5zdHIuIiwiaGF1c251bW1lciI6IjYzIiwia2xzaWQiOjE4NTgzNTM3LCJoYXVzbnVtbWVyenVzYXR6IjoiIiwicGx6IjoiNzM3MzMifQ%3D%3D,460219,n,y,https://pictures.immobilienscout24.de/listings/035ea2c2-c9d5-4414-a3c0-a947fab813b2-1925254817.jpg/ORIG/resize/118x118%3E/extent/118x118/format/webp/quality/73,21,20,1987,,mettingen,false,160701771,2,gas,y,false,y,baden_württemberg,y,7,4,,https://www.telekom.de/festnetz/tarife-und-optionen/internet-dsl,no_information,energy_consumption,87,esslingen_kreis,73733,well_kept,no_information,,E,false,underground_garage,no_information,n,flow:0,no_information,maisonette,,4.5,129.1,n,"2,active",true,deutschland,top,wohnung_kauf,n,false,19,3,250 MBit/s,001.460219,332000,profile0,,esslingen_am_neckar,4,true,n,Mettingen,n,n,Esslingen_am_Neckar,1616,4,Esslingen_Kreis,https://www.immobilienscout24.de/expose/160701771,2025-07-28,01:23:24,2025-07-26T19:15:10.000+02:00,"""Haus im Haus"" mit schöner Aussicht","Wer gerne im Dachgeschoss wohnt, wird sich in dieser hellen 4,5-Zimmer-Maisonette-Wohnung sofort wohlfühlen. 

Durch die großen Fensterflächen fällt viel Licht in die Räume und erzeugt eine angenehme Atmosphäre.

Auf der ersten Ebene der Wohnung befindet sich der Eingangsbereich mit einer Diele. Von hier aus kommen Sie über eine Türe in den Wohnbereich oder über eine Treppe auf die zweite Ebene. 

Auf der ersten Ebene sind neben dem Wohn- und Esszimmer noch zwei weitere Räume vorhanden. 

Die Küche liegt unmittelbar neben dem Esszimmer, von dem aus die Dachloggia betreten werden kann. Ein schöner, freier Blick in südwestlicher Richtung wird Sie überzeugen.

Auf der zweiten Ebene empfängt Sie eine freundliche Galerie, die durch 3 Dachflächenfenster gut belichtet wird. 

Von dieser Galerie aus kommt man in ein Schlafzimmer und in ein Tageslichtbad. Zusätzlich gibt es noch einen kleinen praktischen Abstellraum.

Die Maisonette-Eigentumswohnung verfügt über eine Grundfläche von knapp 100 m² und unterstreicht auch diese Wirkung.

Insgesamt bietet diese ansprechende Eigentumswohnung viel Raum. Eine Wohnung zum Wohlfühlen.","- Laminat und Fliesen
- Fenster Isolierverglasung
- Velux Dachflächenfenster 2008 neu
- Velux Verdunkelung plus
- Dach im Jahr 2000 neu eingedeckt
- Neue Heizung 2024
- Vollwärmeschutz 2014
- Balkonsanierung 2014
- zwei Abstellräume in der Wohnung
- zwei Stellplätze in der Tiefgarage
- Hobbyraum (ca. 14 m²)
- Kellerraum
- Waschküche",,disabled,,showqualicontactform,,
Baden_Württemberg,central_heating,eyJvcnQiOiJTdHV0dGdhcnQiLCJvcnRzdGVpbCI6IiIsInN0cmFzc2UiOiJEYXJtc3TkZHRlciBTdHIuIiwiaGF1c251bW1lciI6Ijg3Iiwia2xzaWQiOjE1NDY5NTUzLCJoYXVzbnVtbWVyenVzYXR6IjoiIiwicGx6IjoiNzAzNzYifQ%3D%3D,827649,n,n,https://pictures.immobilienscout24.de/listings/eca84149-aecd-4144-bb7c-e0ca5b726533-1925303656.jpg/ORIG/resize/118x118%3E/extent/118x118/format/webp/quality/73,6,,,,birkenäcker,false,160703192,,gas,y,false,y,baden_württemberg,y,6,,,https://www.telekom.de/festnetz/tarife-und-optionen/internet-dsl,no_information,energy_consumption,91,stuttgart,70376,no_information,sophisticated,,D,false,outside,no_information,n,flow:0,no_information,roof_storey,,3.5,119,n,"2,active",true,deutschland,top,wohnung_kauf,n,false,10,3,250 MBit/s,001.827649,299000,profile0,,bad_cannstatt,3,true,n,Birkenäcker,n,n,Bad_Cannstatt,1184,4,Stuttgart,https://www.immobilienscout24.de/expose/160703192,2025-07-28,01:23:27,2025-07-26T22:27:54.000+02:00,"Ruhiges wohnen im Birkenäcker- Helle 3,5-Zi-Wohnung mit Balkon!","Diese gut geschnittene 3,5-Zimmerwohnung befindet sich im Dachgeschoss (3. Stock) eines Mehrfamilienhauses mit Satteldach. Die Wohnung hat ein sehr großes Wohnzimmer, zwei Schlafzimmer, einen sehr geräumigen Flur mit Diele, ein Tageslichtbad und eine großzügige Essküche. Die schöne Dachterrasse kann man sowohl vom  Wohnzimmer als auch von einem Schlafzimmer aus betreten. Im Tiefparterre befindet sich noch ein zur Wohnung gehörender ca. 15 m² großer beheizbarer Hobbyraum mit Fenster. Am Eingang zum Grundstück befindet sich ein zur Wohnung gehörender Stellplatz. Die Wohnung ist bezugsfrei.","- Zentralheizung
- Isolierglasfenster Zweifachverglasung
- Rollläden und Jalousien
- Böden mit Parkett und Fliesen
- Tageslichtbad mit Dusche, Wanne und Bidet
- separates WC
- großer Balkon mit Zugang von Wohnzimmer und Schlafzimmer 
- elektrische Markise
- separater Hobbyraum
-Waschküche
-Trockenraum
- Stellplatz",,,,showqualicontactform,1,
Baden_Württemberg,gas_heating,eyJvcnQiOiJTdHV0dGdhcnQiLCJvcnRzdGVpbCI6IiIsInN0cmFzc2UiOiJBbSBXb2xmc2JlcmciLCJoYXVzbnVtbWVyIjoiNSIsImtsc2lkIjoxNzA5MTEwMywiaGF1c251bW1lcnp1c2F0eiI6IiIsInBseiI6IjcwNTk3In0%3D,19903261,n,y,https://pictures.immobilienscout24.de/listings/5e1f8d39-3ef8-4a6a-947c-93b3baddab07-1925175468.jpeg/ORIG/resize/118x118%3E/extent/118x118/format/webp/quality/73,36,17,1991,,hoffeld,true,143201248,1,gas,y,false,n,baden_württemberg,y,8,5,,https://www.telekom.de/festnetz/tarife-und-optionen/internet-dsl,no_information,,91,stuttgart,70597,modernized,sophisticated,,,false,duplex,no_information,y,flow:0,no_information,terraced_flat,,3.5,,n,"2,active",true,deutschland,top,wohnung_kauf,n,false,7,0,250 MBit/s,001.18895244,449000,profile1_listingtype,5,degerloch_bezirk,3,true,y,Hoffeld,y,n,Degerloch_Bezirk,143201248,4,Stuttgart,https://www.immobilienscout24.de/expose/143201248,2025-07-28,01:23:30,2025-07-27T19:31:45.000+02:00,"3,5 Zimmer Eigentumswohnung mit schöner Terrasse und Gartenanteil in Hoffeld","Tolle Chance - eine ansprechende & baujahrtypische Wohnung mit kleinem Garten und grüner Umgebung im schönen Stuttgart Hoffeld - zu erwerben. 

Die Wohnung ist in einem gepflegten Zustand und sofort bezugsbereit. 

Neben drei schönen Zimmern, zählen zu der Wohnung ein funktionales Bad,  sowie ein separates WC. Eine ruhig gelegene und schöne kleine Terrasse mit Gartenanteil lädt zum Verweilen im Freien ein. Ein praktischer Hobbyraum direkt angrenzend an der Wohnung kann flexibel genutzt werden (aktuell kleines HomeOffice Büro).  Der Flur ist praktisch geschnitten mit einer interessanten Nische. 

Beheizt wird das Objekt aus dem Jahr 1991 mit insgesamt 39 Wohneinheiten per effizienter Gas-Heizung (Viessmann).

Energieausweis liegt zur Besichtigung vor. 

Besonders hervorzuheben ist das große Wohn- und Esszimmer, die Terrasse mit Garten und der direkte Zugang zum Naturschutzgebiet Ramsbachtal. Eine funktionale Einbauküche verbleibt auf Wunsch in der Wohnung.

Im Keller befinden sich Abstellräume, ein Waschraum mit Waschmaschinenanschluss und ein Fahrradraum. 

Im Jahr 2023 wurden die Balkongeländer saniert, 2018 ist die Fassade angestrichen worden. 

Lage im grünen zwischen zwei verkehrsberuhigten Sackgassen (kein Durchgangsverkehr).","Wohn- und Esszimmer mit großen Fenstern und Zugang zum schönen kleinen Garten.  

Kinder-/ Gästezimmer und Schlafzimmer gut geschnitten.

Funktionale Einbauküche mit Geräten verbleibt in der Wohnung.

Bad mit Dusche und Badewanne und ein separates WC.

1 Hobbyraum (6,52m2) gehört zur Wohnung mit Zugang über die Terrasse (nicht eingerechnet in der Wohnfläche).

1 Kellerraum gehört zur Wohnung. 

1 Doppelparker (Duplex, auch geeignet für diverse  SUVs) Stellplatz in der Tiefgarage gehört zur Wohnung (gegen Aufpreis); erneuert im Jahr 2018.

PKW-Stellplätze 8 Stück im Freien direkt am Haus (Gemeinschaftseigentum).

Öffentliche Ladesäule für E-Fahrzeuge direkt am Objekt vorhanden.

Hausmeisterservice vorhanden.
Hausmeister vor Ort, Mo.-Fr.","Die Immobilie befindet sich in beliebter  Wohnlage in Stuttgart Hoffeld. 
Stuttgart Hoffeld, ein Stadtteil, der unmittelbar an Degerloch angrenzt, zeichnet sich durch die Stille des Ramsbachtals und die ausgezeichnete Anbindung an den öffentlichen Nahverkehr aus. In nur wenigen Minuten gelangen Sie nach Degerloch, wo Sie vielfältige Einkaufsmöglichkeiten vorfinden. Aus Degerloch sind Sie sehr schnell in der City, ebenfalls die neue U-Bahn Anbindung zur Messe/Flughafen ist ideal. 

Top ruhige Lage am Naturschutzgebiet!

Hoffeld ist für Ruhesuchende genau das Richtige - Inmitten von Feldern und Wäldern gelegen, kann man trotzdem die Vorzüge des ""großen Bruders"" Degerloch schnell genießen. 
Durch die freien grünen Flächen und Sportangebote in der Umgebung ist Hoffeld auch für Familien sehr zu empfehlen (Kindergarten vorhanden).

Einkaufsmöglichkeiten (Supermarkt, Bäcker, Schreibwarengeschäft) sind vor Ort vorhanden.",,,,,2023
Baden_Württemberg,gas_heating,eyJvcnQiOiJTdHV0dGdhcnQiLCJvcnRzdGVpbCI6IiIsInN0cmFzc2UiOiJTdGVybnRhbGVyd2VnIiwiaGF1c251bW1lciI6IjEyIiwia2xzaWQiOjU4ODMyMTMsImhhdXNudW1tZXJ6dXNhdHoiOiIiLCJwbHoiOiI3MDU2NyJ9,20683243,n,y,https://pictures.immobilienscout24.de/listings/c0a410be-ef22-47c2-b9ac-0d5498248cae-1925270023.jpg/ORIG/resize/118x118%3E/extent/118x118/format/webp/quality/73,12,,1969,,möhringen_süd,true,160700325,1,no_information,y,false,n,baden_württemberg,y,1,2,,https://www.telekom.de/festnetz/tarife-und-optionen/internet-dsl,12,,86,stuttgart,70567,well_kept,sophisticated,,,false,no_information,Sterntalerweg,n,flow:0,Sterntalerweg,roof_storey,,3,,n,"2,active",true,deutschland,standard,wohnung_kauf,n,false,7,,175 MBit/s,009.d4afdbe2-c114-498b-b278-8516d30016de,0,profile1_listingtype,,möhringen,3,true,n,Möhringen_Süd,n,n,Möhringen,160700325,4,Stuttgart,https://www.immobilienscout24.de/expose/160700325,2025-07-28,01:23:34,2025-07-26T17:02:16.000+02:00,Schöne 3-Zimmer-Dachgeschosswohnung mit gehobener Innenausstattung mit Balkon und EBK in Stuttgart,,,,,,,,
Baden_Württemberg,gas_heating,eyJvcnQiOiJLb3Jud2VzdGhlaW0iLCJvcnRzdGVpbCI6IiIsInN0cmFzc2UiOiJCYXVyc3RyLiIsImhhdXNudW1tZXIiOiIzMSIsImtsc2lkIjo4NjA2MjUwLCJoYXVzbnVtbWVyenVzYXR6IjoiIiwicGx6IjoiNzA4MDYifQ%3D%3D,20684135,n,y,https://pictures.immobilienscout24.de/listings/f24543ce-010c-4294-9652-9ff6fb75dafb-1925397352.jpg/ORIG/resize/118x118%3E/extent/118x118/format/webp/quality/73,30,,1978,,,true,160712004,2,gas,y,false,n,baden_württemberg,y,8,3,,https://www.telekom.de/festnetz/tarife-und-optionen/internet-dsl,no_information,energy_consumption,108,ludwigsburg_kreis,70806,modernized,sophisticated,,D,false,underground_garage,no_information,n,flow:0,no_information,ground_floor,,3,107,n,"2,active",true,deutschland,top,wohnung_kauf,n,false,7,0,6 MBit/s,009.8f0a0cb6-ddf3-4863-9a33-8bf6a5e4dd3f,470000,profile1_listingtype,3,kornwestheim,3,true,n,,n,n,Kornwestheim,160712004,5,Ludwigsburg_Kreis,https://www.immobilienscout24.de/expose/160712004,2025-07-28,01:23:38,2025-07-27T16:43:44.000+02:00,Schöne 3-Zimmer-Wohnung mit zwei Terrassen und Einbauküche in Kornwestheim,"Die 3-Zimmer-Wohnung mit einer Wohnfläche von 108 m² befindet sich im Erdgeschoss eines 6-Familienhauses in einem gewachsenem ruhigen Wohngebiet.

Das Kinderzimmer verfügt über zwei Türen. Dadurch besteht die Möglichkeit, mit einer Trennwand die Wohnung in eine 4-Zimmer-Wohnung umzuwandeln.

Das Highlight der Wohnung ist die große nach Süden ausgerichtete Terrasse, auf die Sie aus dem Wohnzimmer und auch aus dem Schlafzimmer gelangen. Die Terrasse ist teilweise überdacht und verfügt über drei Markisen, sodass auch bei strahlendem Sonnenschein und warmen Temperaturen genügend Schatten zum Verweilen vorhanden ist.

Von der Küche und dem Kinderzimmer haben Sie Zugang zu einer kleinen nach Norden ausgerichteten Terrasse.

Die Wohnung verfügt über ein innenliegendes Badezimmer und ein separates WC.

Ein großzügiger, gemauerter Keller bietet Ihnen zusätzlichen Stauraum. Ein gemeinschaftlicher Waschraum mit Anschlüssen für Waschmaschine und Trockner ist vorhanden.

Zur Wohnung gehört ein Tiefgaragen- und ein Außenstellplatz. Der Außenstellplatz grenzt an die nach Norden ausgerichtete Terrasse.

Die gesamte Wohnanlage mit 15 Wohneinheiten wurde 1978 erbaut

Ausstattung:

Wände mit Rauputz,
Kunststoffisolierglasfenster (zweifachverglast),
Teppichboden im Wohn-/Schlafbereich, darunter Fliesen,
Küche, Bad und WC sind gefliest.

Gaszentralheizung
Energieausweis liegt vor

Die Einbauküche und der Einbauschrank im Flur sind im Preis enthalten
Weitere Möbel können gerne übernommen werden.

",,,,,,,2018
